28,08/23/2019,IneedadviceI’vecometorealisationIhaveanEDthispastweek,"I’ve had a eating disorder for over a year and it started after doing a type of diet and losing a lot of weight, It gave me so much confidence and joy I just wanted to maintain my new body. I was careful of what I ate but slowly I would started developing bulimia it wasn’t excessive I would occasionally do it when I overate. I went through periods where I did it a lot then stopping.","I’ve had a eating disorder for over a year and it started after doing a type of diet and losing a lot of weight, It gave me so much confidence and joy I just wanted to maintain my new body. I was careful of what I ate but slowly I would started developing bulimia it wasn’t excessive I would occasionally do it when I overate. I went through periods where I did it a lot then stopping.7 weeks ago I decided I needed to lose weight after noticing I had gained X pounds after not monitoring or calorie counting. I was so upset I wanted to give up my unhealthy purging habit but felt so inadequate and punished by own body, when I realised I gained that much weight in such a short time. It basically justified my reasons to purge.","I’ve had a eating disorder for over a year and it started after doing a type of diet and losing a lot of weight, It gave me so much confidence and joy I just wanted to maintain my new body. I was careful of what I ate but slowly I would started developing bulimia it wasn’t excessive I would occasionally do it when I overate. I went through periods where I did it a lot then stopping.7 weeks ago I decided I needed to lose weight after noticing I had gained X pounds after not monitoring or calorie counting. I was so upset I wanted to give up my unhealthy purging habit but felt so inadequate and punished by own body, when I realised I gained that much weight in such a short time. It basically justified my reasons to purge.6 days ago I noticed I lost weight in 7 weeks, I went into panic mode and decided to start eating again. Since then I’ve gained  X kg  I’m close to the weight I want to be At I want stay at a certain weight. I’m just having anxiety with such rapid weight gain in such a short space of time. ","I’ve had a eating disorder for over a year and it started after doing a type of diet and losing a lot of weight, It gave me so much confidence and joy I just wanted to maintain my new body. I was careful of what I ate but slowly I would started developing bulimia it wasn’t excessive I would occasionally do it when I overate. I went through periods where I did it a lot then stopping.7 weeks ago I decided I needed to lose weight after noticing I had gained X pounds after not monitoring or calorie counting. I was so upset I wanted to give up my unhealthy purging habit but felt so inadequate and punished by own body, when I realised I gained that much weight in such a short time. It basically justified my reasons to purge.6 days ago I noticed I lost weight in 7 weeks, I went into panic mode and decided to start eating again. Since then I’ve gained  X kg  I’m close to the weight I want to be At I want stay at a certain weight. I’m just having anxiety with such rapid weight gain in such a short space of time. I know I sound pretentious and shallow but I don’t want to go past a certain level of weight, i feel confident and happy when I see myself in the mirror plus it’s a healthy BMI range. I never intended to be skinny I just wanted to maintain the weight I got down to after my weight loss journey. I want to stay at X pounds.","I’ve had a eating disorder for over a year and it started after doing a type of diet and losing a lot of weight, It gave me so much confidence and joy I just wanted to maintain my new body. I was careful of what I ate but slowly I would started developing bulimia it wasn’t excessive I would occasionally do it when I overate. I went through periods where I did it a lot then stopping.7 weeks ago I decided I needed to lose weight after noticing I had gained X pounds after not monitoring or calorie counting. I was so upset I wanted to give up my unhealthy purging habit but felt so inadequate and punished by own body, when I realised I gained that much weight in such a short time. It basically justified my reasons to purge.6 days ago I noticed I lost weight in 7 weeks, I went into panic mode and decided to start eating again. Since then I’ve gained  X kg  I’m close to the weight I want to be At I want stay at a certain weight. I’m just having anxiety with such rapid weight gain in such a short space of time. I know I sound pretentious and shallow but I don’t want to go past a certain level of weight, i feel confident and happy when I see myself in the mirror plus it’s a healthy BMI range. I never intended to be skinny I just wanted to maintain the weight I got down to after my weight loss journey. I want to stay at X pounds.I’m currently eating X calories a day for a week and I’m happy to regain as I know it’s good for my body and it’s rebuilding. But with just rapid weight gain am coming close to my goal weight. I want to give up my eating disorder and I will but I’m worried once I reach this how do I maintain and look ahead to the future. I read online about metabolic disorders and it freaks me out hope someone reading this can give me advice.","Dear mfwarlock, we would like to inform you that we edited your post to remove weight and calorie numbers, as well as mentions of specific diet regimens, which are not allowed on the forums. You can review our community guidelines here. Thanks for your understanding and please continue to post! ","It’s been 13 days since I’ve been eating again, I was calorie counting when I started being restrictive I told myself I would eat only X a day but I made a habit of over calculating to be on the safe side so I’m assuming I was probably eating around X a day. But during that week the first few days I was excessive I was roughly consuming X amount (I’m still guilty of over calculating now) but it was definitely inbetween that number. I’m just lost I don’t know what I’m doing and the uncertainty of the method I’m using to refeed is further driving me into panic. For the past 3 days however I’ve noticed my excessive hunger has decreased am consuming a regular caloric intake. I’m I still at risk of refeeding syndrome considering it’s been 2 weeks of eating again? ","It’s been 13 days since I’ve been eating again, I was calorie counting when I started being restrictive I told myself I would eat only X a day but I made a habit of over calculating to be on the safe side so I’m assuming I was probably eating around X a day. But during that week the first few days I was excessive I was roughly consuming X amount (I’m still guilty of over calculating now) but it was definitely inbetween that number. I’m just lost I don’t know what I’m doing and the uncertainty of the method I’m using to refeed is further driving me into panic. For the past 3 days however I’ve noticed my excessive hunger has decreased am consuming a regular caloric intake. I’m I still at risk of refeeding syndrome considering it’s been 2 weeks of eating again? Forgot to mention I finally told my therapist that I have an ED that I’ve been using symptoms for over a year ( when I’m restrictive I don’t do this)  and my fear of becoming fat again, but I failed to mention that I was underweight as well as the physical symptoms I was experiencing. I did ask her to refer me to an Dietitician and she said she’ll try her best. I also told her about the incident with the GP and how he scoffed at me when I asked for a referral and she told me to go and see a different doctor.","Dear mfwarlock, we would like to inform you that we edited your post to remove calorie numbers, as well as specific disordered eating behaviors, which are not allowed on the forums. You can review our community guidelines here. Thanks for your understanding!","I'm truly surprised that administrator account didn't refer you to a specialist. But, I'm here to lend you a friendly reminder that you are not alone! This whole forum is filled with people experiencing a journey similar to your own. Always remember that everyone here can help you, but so can a specialist. Have you tried reaching out to the helpline on NEDA or the chat now thing? They could help you just as much, if not more than everyone on here.
I'm sure if you contact some sort of dietitian also, you could ask them how you can safely give up the ED and how to do so without gaining too much back at once. My personal advice would be progressive re-emersion into eating. (Like, starting off with smaller amounts of food and moving onto regular portions so your body has time to get used to the food) I hope that makes sense :/ However, I'm no professional, so don't take my advice to seriously.
Reach out to someone because this journey of recovery could get lonely.. We're here for you and want to help
If you see this message, try and keep in touch perhaps?","We aren't allowed to mention numbers.   It looks like the administration's deleted these numbers in the first post, as they are triggering.  They were triggering for me.  Please keep this in mind.  That aside,  I'm sorry you are struggling and hope you can get the help you need soon.
  The best advice I can give is to see a trained professional in the ED world.",,,,,,,,,,,,,,,,,,,,,,,,
29,08/07/2019,Recovering,"I was just wondering if anyone is recovering on their own. For me i find that when i allow myself to take as much time as i need to do certain things my stomach is more receptive to food. The only problem is that this proccess is both healing but also agonizing. It would take me forever to get up in the morning, for example. I guess the best way to explain it is like a walking meditation, or eating meditation and kind of feels more like a relaxed lethargy. This is where it would take a long time to do a certain task. It's very affective and healing because i become very conscious of my body, but i end up falling back because it can be so daunting and i just quit and stop eating all together. I haven't fully completed like a week or couple days of it even though i know this is the best way for me to recover. I've been dealing with my ED (alone) for so many years. I've tried many different ways to recover and i would just love for it to be over. I am not that good at explaining it but I was just wondering if anyone was going though the same proccess. Also, this place has been so helpful. They really get it. I called for the first time yesterday and i appreciated it so much. It inspired me to write this which I've never thought id do. Thank you everyone and have a happy recovery.","Hi, thank you for posting. Please take a look at our community guidelines here: https://www.nationaleatingdisorders.org/forums/community-guidelines. As an organization, we believe that recovery is possible and we recommend seeking help from a professional (eating disorders specialist) as going through this alone is quite difficult and isnt' something that we would recommend. You mentioned some concerning symptoms so we are just posting this list. The following are just some of the signs of a serious problem that demands immediate medical attention:• accidentally or deliberately caused themselves a physical injury• become suicidal• confused thinking and is not making any sense• delusions (false beliefs) or hallucinations (experiencing things that aren’t there)• disoriented; doesn’t know what day it is, where they are or who they are• vomiting several times a day or has uncontrollable vomiting or diarrhea• experiencing dizziness or fainting spells• too weak to walk or collapses• painful muscle spasms• complaining of chest pain or having trouble breathing• blood in their bowel movements, urine or vomit• a body mass index (BMI) of less than 16• an irregular heartbeat, and fast heartbeat, or very low heart beat (less than 50 beats per minute)• cold or clammy skin indicating a low body temperature or has a body temperature of less than 35 degrees Celsius/95 degrees FahrenheitOr any other serious medical concernsIf you experience anything on here, we highly recommend seeking medical attention as soon as possible. Another option is 911. Seek medical help soon on an outpatient basis if you:• have significant heartburn and/or a burning sensation after eating• have other gastrointestinal concerns• have high blood pressure• struggle with significant joint or muscle pain• have difficulty sleeping (falling and/or remaining asleep)• struggle with fatigue, sudden weight gain, and/or hair loss• have frequent urination or unquenchable thirst• have gained and lost significant weight repeatedly• have gained significant weight in a short period of time• struggle with chronic diarrhea or constipationIf you’re looking for resources, please feel free to contact the Helpline at (800) 931-2237. The Helpline is open Mondays-Thursdays 9AM-9PM EST and Fridays 9AM-5PM EST. During these hours you can chat with us also by clicking the chat now option at the top right hand corner!  Please continue posting!  ","These people at NEDA on all the forums, all the chat rooms, and all the helplines are here to help! Don't ever think that you're not alone! This whole website is an entire community of people who want to help or want to recover. Keep pressing on, and (like the administrator suggested) seek professional help! It can be a hard struggle with an ED and it is even harder trying to recover on your own. I have used their helplines, and they are very helpful, so I would suggest trying them for yourself. Please reach out to someone, this is a process no person should have to face alone, no matter how capable they are.
Best of luck to you and your recovery, reach out to someone, and keep posting
You're not alone",,,,,,,,,,,,,,,,,,,,,,,,,,,,,,,,
30,07/18/2019,OptionsinPAforBDDandED,"My earliest accounts of suffering are at the age of 14. I am now 23. When I was 19 I received a diagnosis of body dysmorphic disorder. Just a few months ago I was diagnosed with an eating disorder. It is hard for me to write here because my perception of myself has made certain aspects of my life much more difficult. The best way to explain my situation now, is to touch base on the past few years. I became extremely self conscious at 14 after I developed cystic acne. I mean, it was just unusual. It led me to skip school, not look people in the eye, and just socially withdraw from almost everyone except my family and girlfriend who acted as both a lover and best friend. The times I was in school, my ""friends"" would say out of shock ""OMG did you get into a fight""... or times at fast food restaurants there was a sudden conversation about how greasy foods affect your skin; probably started by looking at me then ended with suggestions on what I could do to improve my skin. Well, thankfully my mom took me to a dermatologist. From that first appointment until now the remedy has been the perscriptions they provided me. Its important to note that since I was 17 my acne has been under control, which I am beyond thankful for. My self consciousness was not just limited to my skin. I also despised my nose. I mean despised. I remember getting into countless fights with my parents and girlfriend over financing for it. Told my therapist how uncomfortable it made me and swore that I would eventually have plastic surgery to fix it. Well, that still hasn't happened. My senior year (aged 17-18) I ended the relationship with my girlfriend after 3.5 years together. I cared about her deeply but felt that I was indeed attracted to the opposite sex. So, I came out. It was relieving and I could not have asked for a more supportive network. However, upon coming out... it left a lot of questions for me to answer from others. ""Are you the 'woman' or 'man'"", ""You do not LOOK gay"", ""You are a failure at being gay"". These questions in association with ""suggestions"" on how to improve on being ""gay"" just really hurt me. I know that being gay, liking the same sex, has absolutely nothing to do with the way you look or behave but there is infact this stereotype I struggled to deal with. I had a lot of remarks about my hair. I was shaving it but after suggestions on to grow it out, I tried. I mean tried. After a lot of research I ended up going back to my dermo. with the complaint and she gave me some perscriptions. I truly want to say, it has in fact done WONDERS.i While yes, my hair condition was being handled. I still was receiving this ongoing feedback regularly on how to improve my appearance (even writing this I just cannot understand why their was so much emphasis on my physical appearance in relation to my sexuality but their in fact was). I remember hearing from multiple people that I was a ""failure at being gay"" because I did not look a certain way, like certain things, etc.. Underlying all of this was this ongoing preoccupation with my appearance apparently people did not perceive I was concerned about; when I actually was. In January 2017 I started to go to the gym. Where I currently am, I work at a gym. My peak was Sept-December 2018. I had lost over X pounds however gained a lot of lean muscle. Truth was I was exercising all the time plus restricting my calorie intake. At my lowest I was Xlbs 5'4"". Around November 2018 I knew the holidays were here and I wanted to eat. I honestly forget where I saw it but that was when I started taking laxatives. It's so embarrassing. After overeating, I fast. This is still going on and I do it out of pain. I feel like I am just so ashamed of my physical appearance. I am always hungry. Probably because of how much a train + the emotional turmoil of it all. I went to my doctor a few months ago, told her my concerns. She knows I have been struggling (in 2016 I was diagnosed with BDD after an involuntary hospitalization). She diagnosed me with an eating disorder and referred me to a nutritionist. They both felt like I need impatient but it was in the middle of my semester. I still struggle everyday with food, binge eating, fasting or using laxatives. All for a compliment... I need help but I am so concerned with this derailing my graduation in May. I also cannot afford to take off work. Please, what resources are available for me?","Hi, JMC41996. Thank you for posting. We're sorry to hear about what's been going on with your body image and eating concerns. We hope that you get the support you deserve here on the forum. We just wanted to let you know that we edited out portions of your post as numbers and certain language might be triggering for other members of the forum. We also took out names of certain medications. Please take a look at our community guidelines here: https://www.nationaleatingdisorders.org/forums/community-guidelines. If you're interested in resources, you can reach out to the Helpline at (800) 931-2237. The Helpline is open Monday-Thursday 9AM-9PM EST and Friday 9AM-5PM EST. You can also chat during these hours by clicking on the chat now button at the top right hand corner. Please take care! ",,,,,,,,,,,,,,,,,,,,,,,,,,,,,,,,,
31,04/19/2019,Ifeelinvalid,"I keep fluctuating in terms of how much I want to recover and how much I want to restrict; it makes me invalid because I keep saying to myself, ""If you REALLY had an eating disorder, you would want to restrict all of the time!"" I also try to convince myself that I ""can't be anorexic"" because I'm not currently underweight, even though I've lost significant amounts of weight by restricting. Has anyone else had similar experiences?","I feel like a fake because of the same reason, ‘If you really did have an ED, you wouldn’t be eating all’ The thoughts just play around in my head all day, every day. I want to cut myself again, and again, and again until I stop thinking about it. I’m restricting myself completely at the moment so the though of food makes me gag. I just feel fake and I want to end it all...","I feel like a fake because of the same reason, ‘If you really did have an ED, you wouldn’t be eating all’ The thoughts just play around in my head all day, every day. I want to cut myself again, and again, and again until I stop thinking about it. I’m restricting myself completely at the moment so the though of food makes me gag. I just feel fake and I want to end it all...Don’t worry, you’re not alone with any of this. There’s always people to talk to.","Dear whatsthepointin...,We are concered about your safety and would like to pass some numbers to contact. This number is really important to have: (800)273-TALK(8255).  If you don't feel comfortable talking, please text ""NEDA"" to 741741 or visit one of these websites:http://www.suicidepreventionlifeline.org/ - or click to chat http://www.dialhelp.org/?page_id=7759 or text 906-356-3337http://www.suicidepreventionlifeline.org/ or text 741-741https://www.imalive.org/ or call 800-784-2433 Please be safe!","Hi.  I just want to ay that I hear you.  But having incisiveness over recovery, wanting to recover and then fearing it is normal.  Eating disorders serve a purpose most of the time.  For me, I was so afraid of people, of being hurt, of just living a regular life, I thought it was easier to just live sick, in hospitals and programs and avoid life.  Well, I eventually had to face life, face my fears.  So for you, figuring out what purpose the eating disorder is serving is essential to overcoming it and this us usually done with the help of a therapist.  So many people suffering with an eating disorder discount the validity based on a number.  Unfortunately insurance companies use numbers but there is something called eating disorder otherwise unspecified.   I think.  It means that you may have anorexia, based on your fears of food, thought patterns and behaviors but since you started losing weight at a higher weight your weight loss doesn't put you in the underweight category.  You may face all the other symptoms that comes along with anorexia.  Atypical anorexia I think is another way to identify it.  But ultimately a term will never identify your exact experience, pain, struggles, fears, whatever you may be feeling.  So try not to get hung up on that so much.  See if you can get help for the underlying cause of the eating disordered behaviors and know you are not the eating disorder.  You are separate from it and it does not define you. You are so much more than any diagnosis.  See if you can get help for the pain it is causing you.  Take care,","Hi.  I just want to ay that I hear you.  But having incisiveness over recovery, wanting to recover and then fearing it is normal.  Eating disorders serve a purpose most of the time.  For me, I was so afraid of people, of being hurt, of just living a regular life, I thought it was easier to just live sick, in hospitals and programs and avoid life.  Well, I eventually had to face life, face my fears.  So for you, figuring out what purpose the eating disorder is serving is essential to overcoming it and this us usually done with the help of a therapist.  So many people suffering with an eating disorder discount the validity based on a number.  Unfortunately insurance companies use numbers but there is something called eating disorder otherwise unspecified.   I think.  It means that you may have anorexia, based on your fears of food, thought patterns and behaviors but since you started losing weight at a higher weight your weight loss doesn't put you in the underweight category.  You may face all the other symptoms that comes along with anorexia.  Atypical anorexia I think is another way to identify it.  But ultimately a term will never identify your exact experience, pain, struggles, fears, whatever you may be feeling.  So try not to get hung up on that so much.  See if you can get help for the underlying cause of the eating disordered behaviors and know you are not the eating disorder.  You are separate from it and it does not define you. You are so much more than any diagnosis.  See if you can get help for the pain it is causing you.  Take care,iwanttolive and I am",,,,,,,,,,,,,,,,,,,,,,,,,,,,,
