5,01/15/2020,todded,iwanttolive,"Hello.  I am sorry you have been struggling for so long.  One thing is that we are not allowed to give out specific treatment center information.  But, we can offer support and help.  If I may, I was wondering why you have not let your wife know of how much you are struggling.  Do you think she suspects something, because even though I am not married, I would think that living with someone who is that close to you probably knows something isn't right and is afraid to bring it up or is waiting for you?  Do you think she is worried about you?  Does it affect your relationship do you think to have this kept from her?  I know these seem like very intrusive questions from a complete stranger. I struggled with eating disorders for most of my life. I am now getting a lot of relief although I still have some struggles.  I found it very difficult to hide from my parents.  Could never do it, they always somehow knew.  Still know when I am struggling even if I don't tell them.If you are planning on going into long term treatment or a day program she will probably have to be told.  How would you feel about her knowing at that point?  Are you feeling shame for struggling?  Because this is not something you dreamt up and said, I want to have an eating disorder.  No. Life events caused you to turn to behaviors because that is what addictions do.  They serve a purpose and that is often to relieve internal pain that has never been dealt with.  Have you ever seen a therapist for this?  NEDA can help you locate treatment providers in your area.  If you really think you need to go inpatient, they can help you find a place as well.  You may want to call different places to see the ratio of men to women and the average age.  It may be helpful information.  Also to know what type of therapy is used:  DBT  or CBT are the two most common.  Knowing how long they give you to finish your meals, if they allow you to select your meals or if they serve you.  Some places go on exchanges and allow you to menu plan, others just serve you and you eat what they serve.  But I am getting ahead of myself.  You first have to decide if you are going to therapy, or if you want to go into the hospital and then start therapy after.  I think if you go to your medical doctor and get checked out medically.  Let your doctor know what is going on.  If you are going to get help  you will probably need to start letting some people know, such as your medical doctor.  It may be scary or embarrassing, but we all struggle with something and shame should not factor into your getting help.  Eating disorders are life threatening and if you think it is out of control I urge you to seek some sort of help.The type of insurance you have will also have an impact on what type of program you may be able to go to.   I know I just threw a lot of information at you.  Hope it wasn't too overwhelming.  I also hope it helped some.  You may never get to this point because you were upset by my initial questions, but I asked them because I have been dealing with the eating disorder a long time and understand family dynamics a lot.  I wasn't trying to be too personal.  You don't even have to answer them on the forum.  They are for you to think about.  So, if you want to, let us know how you are doing.  I'd like to here how you are.iwanttolive",,,,,,,,,,,,,,,,,,
6,01/15/2020,Whitematt881,iwanttolive,"Hello there. First off, I am not a male, sorry.  But I have struggled with eating disorders for a long time.  I am now mostly in recovery.  You are correct in saying much more needs to be done to help males and seniors with eating disorders.  I know someone who is a senior who starting using alcohol to cope and another person said well, older people don't become alcoholics.  I was like...what?  Don't you know how high the rate of alcoholism is in the senior population.  I say that to let you know that people just don't realize that any age, any color, any gender, any economic back round or race do struggle with the same things.  Things like mental illness or eating disorders for staying on topic do not discriminate.  For so long, there were only females in treatment facilities.  For the most part this is still true today.  I am 52.  For a very long time as the eating disorder continued to rule my life, I was one of the oldest person in the program.  I felt terrible that I was such a bad influence for all the youngsters there that it was not good for me.  They really needed to separate the thirteen year old's from the adults as we have different life experiences and issues. For you not being able to find care in a mostly segregated society when it comes to the treatment of eating disorders, I am sorry.  Segregated in terms of programs not having specific help for men, and for older adults who usually start off young and never finding recovery, or having the eating disorder start late in life when life got really difficult.  My hope for you is that things will change quicker than they are.  More awareness is occurring but not quick enough for those as you need help now.  Please feel free to post on the working toward recovery and maintaining recovery.  You may find more support there, even if it isn't always a man giving you the support. I don't know how you feel about that.  My warmest wishes to you and please, keep posting and reaching out for support.iwanttolive",,,,,,,,,,,,,,,,,,
7,05/22/2019,Lowlibido,Yeahokay,"After I started my recovery I thought that the sex drive/libido/drive to do any even non sex related remained at zero even though I'm almost 9 months into recovery so I decided to go to a doctor(endocrinologist) to get some blood work done t-levels thyroid ext and all tests came back fine Wich makes sense because I live a pretty healthy lifestyle now (eat healthy, get exercise, ext) but I was confused why I still have this issue of low libido so I tried changing around my diet (trying to get all the vitamins and minerals I need and getting enough calories) but nothing seemed to work so I don't know Wich direction to go now to get help for this issue",BobJ48,"Thu,05/23/2019-4:23pm","Boy, I don't know, but I'm glad you got tested at least.What do you think - might it be psychological issue ?Sexual matters often involve a lot of psychological things.",JohnDogan,"Fri,01/10/2020-8:07pm",Nevermind,,,,,,,,,,,,
8,11/11/2019,?,okayokay,"I want to be skinny and light and empty, but I want to grow taller and be able to focus and be normal. I am lost",a.thompson120,"Fri,11/15/2019-10:46pm","Hey,I like your username. It's okay to be lost. It's okay to know exactly what you want, but want two contradicting things. It's okay to not know what you're doing, or why.Do you really want to be skinny and light and empty, or is that your ED talking? What do you want to be like in your future? How would being skinny and empty fit in that future? Ask yourself questions, really ask. Let your most hopeful self respond, or even your future self. It sounds flaky and pointless, but it may help you find what you really want.Best of luck, I believe in you.",,,,,,,,,,,,,,,
9,11/03/2019,HowdoIcope?,Westy96,"So I'm a 23 year old male coming to terms with the fact I've had an eating disorder for several years now. I basically have an addiction to sweet things and crave them. These cravings have nothing to do with hunger. I really struggle to acknowledge it as a problem, so I ultimately fail to actually put anything in place to address my issues. This is my main issue. It doesn't help either that I can't really achieve a proper balance. I'm a very 'all or nothing' person in general. I've tried keeping a food diary in the past, but never really took it seriously. I also often forgot to include everything I had eaten. Instead of writing in it as soon as I had eaten, I would fill it in during the evening, but some days I forgot to even fill it in at all. When I did my food diary, seeing it all written down did help to hit home just how quickly a little here and there mounts up.I sometimes feel as if I am having a good day and can afford to be less careful, but I struggle to acknowledge when I have a bad day, or admit it to others. It negatively impacts those around me and comes across as if I do not care, or that I am selfish and arrogant. That is not my intent at all, but I can offer no explanation why I do it, nor can I justify it. I know it's wrong, but I can't help myself. My current action plan is to seek the advice of like minded individuals and hopefully offer my own when I find myself in a better place. This is why I've now signed up to this site. I am also starting a new food diary. I intend to fill it in when I eat, or to make a note on my phone if I am unable to do so. I also plan to fill it in honestly and in detail. Hopefully, this will help break me out of the mindset of being less careful than I need to. Lastly, I hope that if I do have a bad day, I will be able to talk to those I live with about it. To just acknowledge it before I have eaten most of the sweet things in the house. I know I need to change my mindset and the first step is to acknowledge this IS a major issue. And the way I am, I will likely need to keep a food diary for the foreseeable future to help keep on the right track. I'm also hoping that reading through other's posts and responses will help me to improve my own issues and get me to a place where I can also maybe help others.",a.thompson120,"Fri,11/15/2019-10:37pm","Hi Westy96,I'm glad you awknowlegded your problem, found this forum, and decided to do a few things to help it.
I would highly suggest therapy, online or in person. Eating disorders are not something you deserve to deal with alone. The people you live with, your friends, and family can only help to the best of their knowledge but you might want to consider letting many of them know.
It sounds like the you and the people you live with share food, so it may be beneficial for you to ask them to grocery shop for you. That way, you won't buy sugary food on impulse and there may be less sugar in your house.
Speaking of less sugar, cooking is a good habit because it's healthy, and (from my experience) you feel proud of what you made and tend to eat more reasonably.I hope your food diary is going well and that your mindset is getting better. However, remember recovery has many relapses, and does not follow a straight line of improvement. I believe in you!",,,,,,,,,,,,,,,
10,10/16/2019,Howdoyoucope?,Pineapple-Boy,I've been struggling with my relationship with food for a long time. I knew my eating habits weren't normal for a while and have caused me significantly more distress as time goes on. I switch between restricting and over exercising to bingeing. Food is on my mind 24/7. I've been like this for years. I didn't think I had a serious problem until the past week or so. I was watching a show and one of the characters ate/didn't eat like I would. The reaction from a character that saw this gave me a wake up call. I want to get better. I told a friend a little about it but they don't understand and change the subject quickly. My family wouldn't believe me or take me seriously. I don't have access to therapy or support groups right now. Is anyone in a similar situation? How do you cope?,_admin_moderator,"Thu,10/17/2019-6:22pm","We noticed you are having a hard time finding resources in your area. Here at NEDA, we try to provide resources that specialize in eating disorders to help those looking for help. Please remember that you are welcomed to call the NEDA Helpline to talk to someone when you're feeling down. The NEDA Helpline's number is (800)941-2237 and is available Monday-Thursday from 9AM to 9PM ET and Friday from 9AM to 5PM ET.
We hope you're able to find some support through this time and please keep posting!",Pineapple-Boy,"Fri,10/18/2019-8:24pm",I already talked with the hotline. There wasn't much they could do.,Savedbygrace ,"Sat,10/19/2019-1:10pm",The only thing they're willing to do is help you find resources.,Pineapple-Boy,"Wed,10/23/2019-3:45am",I know. I don't have access to any,a.thompson120,"Fri,11/15/2019-10:21pm","Hi,It sounds like you are in a hard situation. From what I know, I can give you a couple tips.-Find an online support group that meets fairly often and connect with people through that. -There are some apps and websites that allow you to talk to therapists online.
-Writing or typing what you eat each day is a good way to assess yourself and keep you motivated to get better.
-If possible, identify what triggers your habits.Remember you don't have to get through this alone. Know that your illness is making your choices and habits with food, not you. Your worth doesn't depend on your illness. I wish you the best.",a.thompson120,"Fri,11/15/2019-10:22pm","Hi,It sounds like you are in a hard situation. From what I know, I can give you a couple tips.-Find an online support group that meets fairly often and connect with people through that. -There are some apps and websites that allow you to talk to therapists online.
-Writing or typing what you eat each day is a good way to assess yourself and keep you motivated to get better.
-If possible, identify what triggers your habits.Remember you don't have to get through this alone. Know that your illness is making your choices and habits with food, not you. Your worth doesn't depend on your illness. I wish you the best."
11,10/12/2019,Supportgroups?,a.thompson120,"I am writing on behalf of my boyfriend, a male teen who has had Anorexia for several years.He is doing well on recovering physically, and has been sticking to three meals a day for a year now. However, he is still battling his mind. For that reason, he is considering going to a support group. Do support groups help? Are they usually female-dominated? Have any of you had success with a male only support group? Or any online support groups?We are doing reseach on nearby groups but would love to hear some advice/answers of our questions. Thanks!",koifish22,"Tue,10/15/2019-7:54pm","Support groups have been researched and they do help, even if the members don't realize it at first. It would probably be more helpful if you found a male based support group, and there are even some online support groups (18Percent) that could be of use. Keep your options open though, because not every support group may be right for your boyfriend. It's great that he has a partner that cares so much!
Good luck!",a.thompson120,"Wed,10/16/2019-2:55pm",Thank you for your response!,,,,,,,,,,,,
12,08/23/2019,IneedadviceI’vecometorealisationIhaveanEDthispastweek,mfwarlock,"I’ve had a eating disorder for over a year and it started after doing a type of diet and losing a lot of weight, It gave me so much confidence and joy I just wanted to maintain my new body. I was careful of what I ate but slowly I would started developing bulimia it wasn’t excessive I would occasionally do it when I overate. I went through periods where I did it a lot then stopping.7 weeks ago I decided I needed to lose weight after noticing I had gained X pounds after not monitoring or calorie counting. I was so upset I wanted to give up my unhealthy purging habit but felt so inadequate and punished by own body, when I realised I gained that much weight in such a short time. It basically justified my reasons to purge.6 days ago I noticed I lost weight in 7 weeks, I went into panic mode and decided to start eating again. Since then I’ve gained  X kg  I’m close to the weight I want to be At I want stay at a certain weight. I’m just having anxiety with such rapid weight gain in such a short space of time. I know I sound pretentious and shallow but I don’t want to go past a certain level of weight, i feel confident and happy when I see myself in the mirror plus it’s a healthy BMI range. I never intended to be skinny I just wanted to maintain the weight I got down to after my weight loss journey. I want to stay at X pounds.I’m currently eating X calories a day for a week and I’m happy to regain as I know it’s good for my body and it’s rebuilding. But with just rapid weight gain am coming close to my goal weight. I want to give up my eating disorder and I will but I’m worried once I reach this how do I maintain and look ahead to the future. I read online about metabolic disorders and it freaks me out hope someone reading this can give me advice.",_admin_moderator,"Mon,08/26/2019-5:06pm","Dear mfwarlock, we would like to inform you that we edited your post to remove weight and calorie numbers, as well as mentions of specific diet regimens, which are not allowed on the forums. You can review our community guidelines here. Thanks for your understanding and please continue to post! ",mfwarlock,"Thu,08/29/2019-10:58pm","It’s been 13 days since I’ve been eating again, I was calorie counting when I started being restrictive I told myself I would eat only X a day but I made a habit of over calculating to be on the safe side so I’m assuming I was probably eating around X a day. But during that week the first few days I was excessive I was roughly consuming X amount (I’m still guilty of over calculating now) but it was definitely inbetween that number. I’m just lost I don’t know what I’m doing and the uncertainty of the method I’m using to refeed is further driving me into panic. For the past 3 days however I’ve noticed my excessive hunger has decreased am consuming a regular caloric intake. I’m I still at risk of refeeding syndrome considering it’s been 2 weeks of eating again? Forgot to mention I finally told my therapist that I have an ED that I’ve been using symptoms for over a year ( when I’m restrictive I don’t do this)  and my fear of becoming fat again, but I failed to mention that I was underweight as well as the physical symptoms I was experiencing. I did ask her to refer me to an Dietitician and she said she’ll try her best. I also told her about the incident with the GP and how he scoffed at me when I asked for a referral and she told me to go and see a different doctor.",_admin_moderator,"Fri,08/30/2019-9:27am","Dear mfwarlock, we would like to inform you that we edited your post to remove calorie numbers, as well as specific disordered eating behaviors, which are not allowed on the forums. You can review our community guidelines here. Thanks for your understanding!",koifish22,"Mon,08/26/2019-7:28pm","I'm truly surprised that administrator account didn't refer you to a specialist. But, I'm here to lend you a friendly reminder that you are not alone! This whole forum is filled with people experiencing a journey similar to your own. Always remember that everyone here can help you, but so can a specialist. Have you tried reaching out to the helpline on NEDA or the chat now thing? They could help you just as much, if not more than everyone on here.
I'm sure if you contact some sort of dietitian also, you could ask them how you can safely give up the ED and how to do so without gaining too much back at once. My personal advice would be progressive re-emersion into eating. (Like, starting off with smaller amounts of food and moving onto regular portions so your body has time to get used to the food) I hope that makes sense :/ However, I'm no professional, so don't take my advice to seriously.
Reach out to someone because this journey of recovery could get lonely.. We're here for you and want to help
If you see this message, try and keep in touch perhaps?",Savedbygrace ,"Fri,08/30/2019-8:21am","We aren't allowed to mention numbers.   It looks like the administration's deleted these numbers in the first post, as they are triggering.  They were triggering for me.  Please keep this in mind.  That aside,  I'm sorry you are struggling and hope you can get the help you need soon.
  The best advice I can give is to see a trained professional in the ED world.",,,
13,08/07/2019,Recovering,imgoingtorecover,"I was just wondering if anyone is recovering on their own. For me i find that when i allow myself to take as much time as i need to do certain things my stomach is more receptive to food. The only problem is that this proccess is both healing but also agonizing. It would take me forever to get up in the morning, for example. I guess the best way to explain it is like a walking meditation, or eating meditation and kind of feels more like a relaxed lethargy. This is where it would take a long time to do a certain task. It's very affective and healing because i become very conscious of my body, but i end up falling back because it can be so daunting and i just quit and stop eating all together. I haven't fully completed like a week or couple days of it even though i know this is the best way for me to recover. I've been dealing with my ED (alone) for so many years. I've tried many different ways to recover and i would just love for it to be over. I am not that good at explaining it but I was just wondering if anyone was going though the same proccess. Also, this place has been so helpful. They really get it. I called for the first time yesterday and i appreciated it so much. It inspired me to write this which I've never thought id do. Thank you everyone and have a happy recovery.",_admin_moderator,"Wed,08/07/2019-5:52pm","Hi, thank you for posting. Please take a look at our community guidelines here: https://www.nationaleatingdisorders.org/forums/community-guidelines. As an organization, we believe that recovery is possible and we recommend seeking help from a professional (eating disorders specialist) as going through this alone is quite difficult and isnt' something that we would recommend. You mentioned some concerning symptoms so we are just posting this list. The following are just some of the signs of a serious problem that demands immediate medical attention:• accidentally or deliberately caused themselves a physical injury• become suicidal• confused thinking and is not making any sense• delusions (false beliefs) or hallucinations (experiencing things that aren’t there)• disoriented; doesn’t know what day it is, where they are or who they are• vomiting several times a day or has uncontrollable vomiting or diarrhea• experiencing dizziness or fainting spells• too weak to walk or collapses• painful muscle spasms• complaining of chest pain or having trouble breathing• blood in their bowel movements, urine or vomit• a body mass index (BMI) of less than 16• an irregular heartbeat, and fast heartbeat, or very low heart beat (less than 50 beats per minute)• cold or clammy skin indicating a low body temperature or has a body temperature of less than 35 degrees Celsius/95 degrees FahrenheitOr any other serious medical concernsIf you experience anything on here, we highly recommend seeking medical attention as soon as possible. Another option is 911. Seek medical help soon on an outpatient basis if you:• have significant heartburn and/or a burning sensation after eating• have other gastrointestinal concerns• have high blood pressure• struggle with significant joint or muscle pain• have difficulty sleeping (falling and/or remaining asleep)• struggle with fatigue, sudden weight gain, and/or hair loss• have frequent urination or unquenchable thirst• have gained and lost significant weight repeatedly• have gained significant weight in a short period of time• struggle with chronic diarrhea or constipationIf you’re looking for resources, please feel free to contact the Helpline at (800) 931-2237. The Helpline is open Mondays-Thursdays 9AM-9PM EST and Fridays 9AM-5PM EST. During these hours you can chat with us also by clicking the chat now option at the top right hand corner!  Please continue posting!  ",koifish22,"Fri,08/23/2019-7:26pm","These people at NEDA on all the forums, all the chat rooms, and all the helplines are here to help! Don't ever think that you're not alone! This whole website is an entire community of people who want to help or want to recover. Keep pressing on, and (like the administrator suggested) seek professional help! It can be a hard struggle with an ED and it is even harder trying to recover on your own. I have used their helplines, and they are very helpful, so I would suggest trying them for yourself. Please reach out to someone, this is a process no person should have to face alone, no matter how capable they are.
Best of luck to you and your recovery, reach out to someone, and keep posting
You're not alone",,,,,,,,,,,,
