14,07/18/2019,OptionsinPAforBDDandED,JMC41996,"My earliest accounts of suffering are at the age of 14. I am now 23. When I was 19 I received a diagnosis of body dysmorphic disorder. Just a few months ago I was diagnosed with an eating disorder. It is hard for me to write here because my perception of myself has made certain aspects of my life much more difficult. The best way to explain my situation now, is to touch base on the past few years. I became extremely self conscious at 14 after I developed cystic acne. I mean, it was just unusual. It led me to skip school, not look people in the eye, and just socially withdraw from almost everyone except my family and girlfriend who acted as both a lover and best friend. The times I was in school, my ""friends"" would say out of shock ""OMG did you get into a fight""... or times at fast food restaurants there was a sudden conversation about how greasy foods affect your skin; probably started by looking at me then ended with suggestions on what I could do to improve my skin. Well, thankfully my mom took me to a dermatologist. From that first appointment until now the remedy has been the perscriptions they provided me. Its important to note that since I was 17 my acne has been under control, which I am beyond thankful for. My self consciousness was not just limited to my skin. I also despised my nose. I mean despised. I remember getting into countless fights with my parents and girlfriend over financing for it. Told my therapist how uncomfortable it made me and swore that I would eventually have plastic surgery to fix it. Well, that still hasn't happened. My senior year (aged 17-18) I ended the relationship with my girlfriend after 3.5 years together. I cared about her deeply but felt that I was indeed attracted to the opposite sex. So, I came out. It was relieving and I could not have asked for a more supportive network. However, upon coming out... it left a lot of questions for me to answer from others. ""Are you the 'woman' or 'man'"", ""You do not LOOK gay"", ""You are a failure at being gay"". These questions in association with ""suggestions"" on how to improve on being ""gay"" just really hurt me. I know that being gay, liking the same sex, has absolutely nothing to do with the way you look or behave but there is infact this stereotype I struggled to deal with. I had a lot of remarks about my hair. I was shaving it but after suggestions on to grow it out, I tried. I mean tried. After a lot of research I ended up going back to my dermo. with the complaint and she gave me some perscriptions. I truly want to say, it has in fact done WONDERS.i While yes, my hair condition was being handled. I still was receiving this ongoing feedback regularly on how to improve my appearance (even writing this I just cannot understand why their was so much emphasis on my physical appearance in relation to my sexuality but their in fact was). I remember hearing from multiple people that I was a ""failure at being gay"" because I did not look a certain way, like certain things, etc.. Underlying all of this was this ongoing preoccupation with my appearance apparently people did not perceive I was concerned about; when I actually was. In January 2017 I started to go to the gym. Where I currently am, I work at a gym. My peak was Sept-December 2018. I had lost over X pounds however gained a lot of lean muscle. Truth was I was exercising all the time plus restricting my calorie intake. At my lowest I was Xlbs 5'4"". Around November 2018 I knew the holidays were here and I wanted to eat. I honestly forget where I saw it but that was when I started taking laxatives. It's so embarrassing. After overeating, I fast. This is still going on and I do it out of pain. I feel like I am just so ashamed of my physical appearance. I am always hungry. Probably because of how much a train + the emotional turmoil of it all. I went to my doctor a few months ago, told her my concerns. She knows I have been struggling (in 2016 I was diagnosed with BDD after an involuntary hospitalization). She diagnosed me with an eating disorder and referred me to a nutritionist. They both felt like I need impatient but it was in the middle of my semester. I still struggle everyday with food, binge eating, fasting or using laxatives. All for a compliment... I need help but I am so concerned with this derailing my graduation in May. I also cannot afford to take off work. Please, what resources are available for me?",_admin_moderator,"Fri,07/19/2019-1:54pm","Hi, JMC41996. Thank you for posting. We're sorry to hear about what's been going on with your body image and eating concerns. We hope that you get the support you deserve here on the forum. We just wanted to let you know that we edited out portions of your post as numbers and certain language might be triggering for other members of the forum. We also took out names of certain medications. Please take a look at our community guidelines here: https://www.nationaleatingdisorders.org/forums/community-guidelines. If you're interested in resources, you can reach out to the Helpline at (800) 931-2237. The Helpline is open Monday-Thursday 9AM-9PM EST and Friday 9AM-5PM EST. You can also chat during these hours by clicking on the chat now button at the top right hand corner. Please take care! ",,,,,,,,,,,,,,,
15,04/19/2019,Ifeelinvalid,mcrome,"I keep fluctuating in terms of how much I want to recover and how much I want to restrict; it makes me invalid because I keep saying to myself, ""If you REALLY had an eating disorder, you would want to restrict all of the time!"" I also try to convince myself that I ""can't be anorexic"" because I'm not currently underweight, even though I've lost significant amounts of weight by restricting. Has anyone else had similar experiences?",whatsthepointin...,"Thu,04/25/2019-7:21am","I feel like a fake because of the same reason, ‘If you really did have an ED, you wouldn’t be eating all’ The thoughts just play around in my head all day, every day. I want to cut myself again, and again, and again until I stop thinking about it. I’m restricting myself completely at the moment so the though of food makes me gag. I just feel fake and I want to end it all...Don’t worry, you’re not alone with any of this. There’s always people to talk to.",_admin_moderator,"Thu,04/25/2019-10:02am","Dear whatsthepointin...,We are concered about your safety and would like to pass some numbers to contact. This number is really important to have: (800)273-TALK(8255).  If you don't feel comfortable talking, please text ""NEDA"" to 741741 or visit one of these websites:http://www.suicidepreventionlifeline.org/ - or click to chat http://www.dialhelp.org/?page_id=7759 or text 906-356-3337http://www.suicidepreventionlifeline.org/ or text 741-741https://www.imalive.org/ or call 800-784-2433 Please be safe!",iwanttolive,"Fri,05/03/2019-9:33pm","Hi.  I just want to ay that I hear you.  But having incisiveness over recovery, wanting to recover and then fearing it is normal.  Eating disorders serve a purpose most of the time.  For me, I was so afraid of people, of being hurt, of just living a regular life, I thought it was easier to just live sick, in hospitals and programs and avoid life.  Well, I eventually had to face life, face my fears.  So for you, figuring out what purpose the eating disorder is serving is essential to overcoming it and this us usually done with the help of a therapist.  So many people suffering with an eating disorder discount the validity based on a number.  Unfortunately insurance companies use numbers but there is something called eating disorder otherwise unspecified.   I think.  It means that you may have anorexia, based on your fears of food, thought patterns and behaviors but since you started losing weight at a higher weight your weight loss doesn't put you in the underweight category.  You may face all the other symptoms that comes along with anorexia.  Atypical anorexia I think is another way to identify it.  But ultimately a term will never identify your exact experience, pain, struggles, fears, whatever you may be feeling.  So try not to get hung up on that so much.  See if you can get help for the underlying cause of the eating disordered behaviors and know you are not the eating disorder.  You are separate from it and it does not define you. You are so much more than any diagnosis.  See if you can get help for the pain it is causing you.  Take care,iwanttolive and I am",,,,,,,,,
16,09/08/2018,DesiretoRelapse,Oliver278,"I have been living essentially ED-free for years. I considered it a somewhat embarrassing, but otherwise inconsequential part of my past. I'm 23 now, and I was 16-18 back then; I felt like I'd learned and grown and anyway, I didn't *really* have anorexia because I didn't lose enough weight, so it really didn't matter. Then, my doctor told me I'm slightly pre-diabetic, and that I need to lose some weight. I'm aware that I'm overweight these days. Maybe as a result of being on so many SSRI meds, maybe as a result of a somewhat sedentary lifestyle, maybe as a result of not really paying attention to what I eat. Who knows. So I changed my meds with my psychiatrist, downloaded My Fitness Pal, and decided I would eat a certain number of calories a day. Only, I started noticing some troubling things. I would feel pride and happiness when I ate less than I allotted myself. I would feel intense guilt about eating ""bad"" foods, even if my calorie count was fine. And perhaps the most troubling thing, I didn't care at all if I'd skipped a meal or two for whatever reason, and ate less than I should have. I talked with my therapist, and she told me to delete the app and stop counting calories. I talked with my girlfriend, and now she praises me for ""letting myself"" have unhealthy, which annoys me to no end. I just want to be skinny again. And I want the good feelings that come with restriction. It's driving me crazy..TLDR: My Dr says I need to lose weight for my health. Trying to live healthy has caused my anorexia brain to come on full force. I want to relapse like I want oxygen in my lungs.",_admin_moderator,"Wed,09/12/2018-12:27pm","Hello Oliver 278! . A portion of your comment was edited due to specific numbers and behaviors. For further reading, the community guidelines can be found here: https://www.nationaleatingdisorders.org/forums/community-guidelines Thank you and please continue posting.",mcrome,"Fri,04/19/2019-6:56pm","I keep going between wanting to recover and really badly wanting to relapse, so I can definitely relate",,,,,,,,,,,,
17,01/05/2019,Unhealthyeating17yearold,Andrew-harris,"Dear readers. I am 17 years as of tomorrow. For almost aslong as i can remember i have grown up with my dinner being fried foods. Still till this day i have that atleast X times a week. The other days i have no dinner as i work and would rather not eat than eat that. I know it is bad but to what extent i dont know. Other than dinner i eat almost nothing as i never feel hungry, if i do eat it is junk food as i work at the cinemas. No vegetables or fruits either. I do try to drink alot of water though. I am pretty skinny around Xkgs and height probably around 185cm (around 6 foot i think). I would love to know how this would affect my future when im older or know any other facts. I try to be more healthy but in general i do not like the texture of other foods. Any help will be heavilly appreciated as right now some of my friends say i wont live to 30... :/ :( and i dont know what to do",_admin_moderator,"Wed,01/09/2019-5:28pm","Hi, andrew-harris -- welcome to the NEDA forums. We're glad you're here looking for some support. A portion of your post was edited and deleted due to the mention of specific numbers and behaviors. Our community guidelines are always available to review here: https://www.nationaleatingdisorders.org/forums/community-guidelines. In the event you need further assistance, please do not hesitate to call the NEDA helpline at 1-800-931-2237 (Monday-Thursday 9:00am-9:00pm, Friday 9:00am-5:00pm EST).",,,,,,,,,,,,,,,
18,10/20/2018,Orthorexia/Anxiety/Lowselfconfidence/,Ansgani,"Hello,I'm a french 27 man and I suffer of eating disorder since i'm 15 16 approximately. At that age I
 started to question my nutrition after hearing french governemental dietary advices encouraging people to eat less fat, sugar and salt, more fruits, vegetables, ... (you know the script)
I think it's important for you to know that two years before that, I lost my grand mother because of an arterial disease that cause her corpse to malfunction progressively to a point where her life was a nightmare. (her organs weren't sufficiently vascularize so she coundn't eat normally and died in few months)Since that age, i became hypochondriac and it was therefore logical for me to have a total control over my diet and my physical activities to remain in good health. But after many years of training in differents endurance sports and of ""good eating"", I realized that first I'm not happy, second my need to control every aspect of my life is a great source of stress and social isolation and third I don't even know even today at 27 WHAT A GOOD DIET IS. I mean there are so many differents people with so many differents nutrition guidelines to fellow (which are furthermore sometimes contradictory) that it becomes totally impossible to known how to eat well without any doubts. (paleo, vegan, vegetarian, ....)(and i don't even talk about the qualitative aspect of food with all the chemicals they are putting in our food nowadays)So, can you help me to get ride of those doubts that are ruining my life since more than 10 years now in way to at last live a normal and fulfilling life ?Thanks a lot for your help.",BobJ48,"Mon,10/29/2018-5:53pm","Hey there Ansgani,Sorry that your note sat for a while with no response.  I've been trying to get things ready for winter here, before the weather gets bad, and have not been on the computer as much as I normally am. And yes, people can become trapped by things like this alright. While it may seem reasonable to want to protect ourselves by eating right, after a while the whole thing can get obsessive, and suddenly we are not in control at all.  As you said, the stress and anxiety, and the other ways that it begins to effect a person's life can become more and more constraining with time.So yes, how does a person become more flexible. and less under the spell of things like this ?For one thing, as I suspect you are seeing, there really is no one ""perfect diet"".   People have all sorts of different ideas about what's best.   And then there are all those people who eat pretty much whatever they want, and yet somehow they remain alive and healthy.   So it seems reasonable to think that people can indeed be flexible with their intake and still be OK.But yes, there's the food part, and then there's the anxiety and obsessiveness part.  This is just me, of course, but  I think a person needs to look at both of those things.   Simply changing your eating habits is unlikely to address the issue in the way that you would like.  The psychological parts (which are what are at the heart of the matter) will need to be addressed too.   Which may mean getting some psychological counseling, as well some diet advice. Hopefully you'll be able to break free of these obsessions, and will discover a freer and more open life.  As you said, no one like's to find themselves and their lives controlled by things like this. Keep writing ?Bob J.",,,,,,,,,,,,,,,
19,10/23/2018,MarathonTraining,mprunner,"I'm a lifelong runner and distance running has been my sole passion and outlet for as long as I can remember. I'm in the midst of training for my third marathon next month and this phase of training is always hard for me to not view food as a reward/punishment. I know I have disordered thinking about food (particularly with exercise), but what are some tips you guys might have for not believing lies that I don't deserve food or need to earn it?
I wrote much more about this on my blog",_admin_moderator,"Tue,10/23/2018-11:04pm","Hello and welcome to the forums mprunner. Unfortunately, users are not allowed to link to outside websites that have not already been approved by NEDA. But do feel free to find support here on the forums. Thank you.                 https://www.nationaleatingdisorders.org/forums/community-guidelines",,,,,,,,,,,,,,,
20,07/05/2018,Anxietyandstomachissues,adamlevine,"ive been having stomach issues for months now got blood work an CT scan about a month 1/2 ago done rectum checked for blood all came back clear GI Doc says u have no blood in stool so u have IBSD but my stomach just doesn't feel right frequent stomach rumbling , and ""D"" mucous in stool occasional , excessive gas, occasional stomach aces really get to me my mind keeps convincing me thats its so much more then IBS my constant fear and anxiety over thinking that i have some stomach disease is taking over my life i wake up every day in constant fear ive tried anxiety medicine but it made my ""D"" worse a little so im doing it on my own. its so hard to live like this . before this i used to be so happy never down now im the Opposite on im always depressed my wife is frustrated with me because ive lost all motivation to do anything but think about my gut its literally taking over my life im scared to eat certain things cuz i dont want it to give me ""D"" so i eat the same thing basically every day to give me solids tired of living like this i just want to be happy with my amazing family. does anyone have anxiety with stomach issues? has anyone else been diagnosed with IBS without a colonoscopy and fears its something like IBD?",Recovery_Focused,"Sat,07/07/2018-6:32pm","Hi there,Unfortunately we can not diagnose or provide medical advice here so it is great you are working with a treatment team to continue to address your concerns.  Keep communicating with them about your concerns!",Savedbygrace ,"Sat,07/07/2018-8:20pm","Going to your doctor to get checked out. As is mentioned, since we are not medical doctors or medical professionals, we cannot diagnose what you are struggling with.
  A side note: we are not allowed to provide links to sources other than the NEDA website.
  I hope you find answers soon, and I'm sorry you're having to go through this.",,,,,,,,,,,,
