37,phoebesgone,06/04/2021,overeating during anorexia recovery,"(TW: MENTIONS OF EMETOPHOBIA AND ANOREXIA)
hi, ive been recently struggling with anorexia for the past few months. i have been eating more now, and im in the process of fully recovering, but i seem to overeat nearly everytime i eat now, to the point where it causes indigestion and acid reflux. i feel like my body just kinda goes into survival mode causing me to eat until i feel sick. i have emetophobia (fear of vomitting) as well, which was mainly the cause of my ED, so feeling sick puts me into panic attacks. i wanna be able to prevent the overeating, and i wanna know ways to eat slower. please help!! xoxo",_admin_moderator,"Sat,06/05/2021-10:38am",Welcome!,"Hi phoebesgone, Welcome to the forums! We are sorry to hear that you are struggling. If you are in need of more support, you can call our confidential Helpline Monday-Thursday from 11am to 9pm ET, and Friday from 11am to 5pm ET or use the chat. Helpline chat hours are Monday-Thursday from 9am to 9pm ET, and Friday from 9am to 5pm ET. Stay safe and keep posting!",,,,
38,Recoverfreedom,03/18/2021,Recovering from Anorexia,"Hi everyone!I’m currently in recovering from anorexia; however, I’m afraid I have developed binge eating disorder. I have gained weight within 6 months and I feel disgusted with myself. I’ve been having severe bouts of extreme hunger which will turn into full binges. I have been eating a lot of desert each day in addition to my normal food. Just this past month, I have gained more weight and I really want to go back to my eating disorder of anorexia,
I see old pictures of myself and I just don’t feel like myself anymore. I feel like I’m too fat and none of my clothes fit anymore. I’ve tried to just eat healthy, but every evening and every night, I tend to just binge on sugary foods. I seem to do fine until I start eating dinner. It’s like as soon as I start eating, I can’t stop. I just keep wanting high calorie foods. I, really afraid of gaining any weight. Can anybody relate to what I’m feeling or have any helpful advice?
Also, a lot of my friends are going on diets and it’s very triggering for me. Now that summer is coming around, I’m definitely not ready to go swimming as I have gained so much weight and I would not be comfortable in a bathing suit. Do y’all have any advice on filling meals to curb extreme hunger? And is the extreme hunger permanent or is it temporary or have I just developed binge eating?",_admin_moderator,"Sat,03/20/2021-10:28am",Welcome!,"Hi Recoverfreedom, Welcome to the forums! We are so glad you have reached out for support. We just wanted to let you know we edited your post to remove numbers and mentions of specific foods, as they could be triggering to other users. You can find the community guidelines here. We also wanted to let you know that we are unable to give medical advice on the forum. Please reach out to your doctor if you have questions. For more support, you can contact the NEDA helpline Monday-Thursday from 11am to 9pm ET, and Friday from 11am to 5pm ET. You can also chat with our Helpline! Helpline chat hours are Monday-Thursday from 9am to 9pm ET, and Friday from 9am to 5pm ET. Stay safe and keep posting!!",,,,
39,bugplaymom,05/16/2021,afraid of eating,"hello, ive been in recovery for a few weeks now but my brain has been constantly telling me i’ll be sick or food is going to hurt me when i try to eat. its really frightening for me because im worried about my health and i want nothing more than to recover and leave my ED in the past. im wondering if anyone else experiences fear around eating not because of weight gain but because of fear you’ll feel or get sick, and also how to cope with this.",_admin_moderator,"Mon,05/17/2021-11:26am",bugplaymom,"Hi bugplaymom, welcome to the forums. We’re glad you’re here. If you need additional support on your journey to recovery, we encourage you to reach out to the NEDA helpline for assistance in finding available treatment/support options for you. You can contact the NEDA Helpline at 800.931.2237 M-Th 11am -9pm ET and F 11am-5pm ET or you can chat with us online M-Th 9am-9pm ET and F 9am-5pm ET. Please don’t hesitate to reach out, and take care.",,,,
40,hermione3,04/08/2021,Out of control ,My therapist basically said you know you have needed to be in treatment a long time now... I know that but I can’t go and it’s harder now with insurance stuff and a new job. I have hoped to turn it around but it’s like I can’t stop at all..I am so out of control. I keep losing and just it’s all a mess but my labs are fine but they still said I could be in the hospital. I feel I am invincible but my nutritionist said this will kill me...,_admin_moderator,"Mon,04/12/2021-1:54am",hermione3,"Hi hermione3, we’re sorry to hear about what’s going on. Please remember that you can reach out to the NEDA helpline to find available treatment options if you need more support. Helpline hours are Mon-Thurs 11a-9p ET and Fri 11a-5p ET. The helpline chat can be accessed Mon-Thurs 9a-9p ET, and Fri 9a-5p ET. Also, if you ever feel in crisis, you can contact the Crisis Text Line by texting NEDA to 741-741. The suicide hotline is also a resource to use; if you’re ever feeling suicidal or overcome with stress, please contact the hotline at 800-273-TALK. We hope you’re staying safe and continue to reach our to the forums. Please take care.",,,,
41,luness,04/08/2021,Relapsing - But with Different Symptoms?,"Has anyone else experienced a complete lack of appetite and/or food repulsions in their recovery? I can't find anything about this online!
I began my recovery from anorexia almost three years ago and can acknowledge that I never fully recovered, both in terms of weight restoration as well as healing my relationship with food. When I was in the thick of the ED, I craved almost all foods but heavily restricted because I believed everything was unhealthy. I thought about food all the time and frequently cooked for other people. Now I am much less rigid (I abolished most of my food rules), and I don't feel guilty after I eat. However, I almost never feel like eating. My hunger cues are shot, so that doesn't help.  Picking food, cooking food, eating food and cleaning up after food feels like such a waste of time. Occasionally I will make an elegant meal that I feel excited about only to feel repulsed by it halfway through my plate. Some food smells even make me feel sick (and no, I'm not pregnant). Most of the time, though, it's just me scrolling through dozens of recipes on Pinterest only for nothing to look appetizing in the slightest.
I know I need help.  My husband has to literally coerce me into eating every meal, and it's a source of a lot of tension. But my university counseling center turned me away because I needed ""more specialized care,"" and I'm too broke from paying for grad school to be able to pay for the care I need (assuming I can even can get on the long wait list).",_admin_moderator,"Sat,04/10/2021-11:28am",Welcome!,"Hi luness, Welcome to the forums! We wanted to let you know that the NEDA helpline is available for more support. It is open Monday-Thursday from 11am to 9pm ET, and Friday from 11am to 5pm ET. You can also chat with our Helpline! Helpline chat hours are Monday-Thursday from 9am to 9pm ET, and Friday from 9am to 5pm ET.Stay safe and keep posting!",,,,
42,LCheveke,04/09/2021,New to eating disorder and have some questions,"I have have become new to having an eating disorder. I have alot of symptoms and trying to put together a team to help me recover. I have alot symptoms I cant explain. Like legs hurt, crap up alot, feeling HOT or cold.. mostly hot. I have bathroom issues and I cant really sleep. what causes these and other things I didnt mention. My axiety is always high and Im super sensitive to alot of things. I am up to eat 4x a day. but its a struggle.I cant be the only person who has these and other symptoms. anyone can help give me a clue? or suggestions.",_admin_moderator,"Sat,04/10/2021-11:01am",Welcome!,"Hi LCheveke,  Welcome to the forums! LCheveke, you mentioned some concerning symptoms in your post. The following are just some of the signs of a serious problem that demands immediate medical attention:
Seek medical help soon on an outpatient basis if you:
 We also wanted to let you know that we are unable to give medical advice on the forum. Please reach out to your doctor if you have questions. For more support, you can contact the NEDA helpline Monday-Thursday from 11am to 9pm ET, and Friday from 11am to 5pm ET. You can also chat with our Helpline! Helpline chat hours are Monday-Thursday from 9am to 9pm ET, and Friday from 9am to 5pm ET. Stay safe!",,,,
43,hermione3,04/03/2021,Back and still struggling ,I haven’t posted in ages but I am struggling so incredibly bad. I am at a point where I am medically unstable according to my team like I am really On thin ice. My medical doctor is away this week but said I have to be improved weight wise and medically or really she should hospitalize me...I am terrified I can’t go to the hospital now. I got a new job and just started last week so it might have been the wrong choice while in a bad relapse to start a new job bud j have never been in recovery. My nutritionist asked why I still see my team if I do nothing they say. We came to the realization that I need them for intimacy because I can’t be intimate with anyone due to my many traumas. I can talk to my team it’s sad I need professionals in that way but I plan on exploring this deeper with my therapist.,_admin_moderator,"Mon,04/05/2021-1:01am",hermione3,"Hi hermione3, we’re sorry to hear about this challenging time. The forums are here for you, and if you find yourself struggling, we’d like to encourage you to reach out to the Crisis Text Line by texting 741741 or the National Suicide Prevention Hotline, which can be reached at 1-800- 273- TALK (8255). Please don’t hesitate to reach out, and take care. ",,,,
44,imstillgrowing,03/25/2021,The end of dietician sessions and ED Nostalgia,"Hi Recovery Family!It's been so long since I've used this forum. I've been in recovery two years now, which is a huge accomplishment and I'm very proud of myself. But my dietician, who I've been seeing for 3 1/2 years, thinks I'm ready to stop seeing her. I thought I would be excited when this moment came. After all, we've only been seeing each other about once a month for quite some time now. However, I'm feeling fearful and lonely instead of excited. I am pretty solid in my recovery AND I still have a lot of ED nostalgia. There are many nights when I lie awake imagining a relapse. I never thought that two years out I'd still have such pervasive thoughts. I am so thankful that I'm at a space where I can acknowledge these thoughts as just thoughts, and not fall into them. But with the ending of my dietician sessions, I am finding the nostalgia is kicking up a notch, and part of me thinks it's because losing my dietician feels like that--a loss. I know I'm not really losing her, as she says I can always schedule another session if I need it. I think it's also a reminder that I'm not sick anymore. That I don't really fit into the ED community anymore, which was also a loss. Why did no one tell me there would be so much loss in recovery??So I thought I would post here, because I need a little support. I love recovery and all that's it's allowed me to do. And I hate the ED, and the way it's always trying to sneak back into my life. Blessings, fam.",_admin_moderator,"Wed,03/31/2021-5:01pm",Resources ,"Hello, we're sorry to hear about this. Since suicide has been dicussed in this thread, we just wanted to share these resources in case anyone may need to reach out: 
Dial Help Inc.: Call (906) 482-4357 or Text (906) 356-3337 or www.dialhelp.org",_admin_moderator,"Wed,03/31/2021-4:59pm",Editing Note,We’re sorry about what you’ve experienced and we hope that you’re able to get the help and support you need and deserve. Here is a resources that might be helpful: https://hotline.rainn.org/onlineWe had to edit your post because specific details can be triggering for other members on the forum. Please take a look at our guidelines here: https://www.nationaleatingdisorders.org/forums/community-guidelines
45,barewithme,03/15/2021,What Has Happened To My Body - Metabolism ,"Hi All,I've suffered with an eating disorder for over 10 years, starting when I was 17.
I started restricting my food intake-this lasted for about a year or 2 (I was never extremely underweight)I then developed the habit of chewing and spitting my food out (CHSP) starting this was the worst decision I ever made!
I went on with it for 10 years, never eating meals just snacking , and chewing mounds of food in solidarity.During this period my weight fluctuated a lot, I imagine I was taking in some calories from the chewing, so when I wasn't happy with my weight I restricted the chewing (it feels absurd thinking about it)Anyway, I finally reached a breaking point when I was larger in size and the restricting wasn't helping me lose any weight, I wanted to eat normally and be healthy but happy with my body, so I had my resting metabolic rate tested at a university in London.
The results were shocking, my predicted RMR was Xkcal but my actual RMR came back at Xkcal.I was told they had never seen such a low RMR in anyone of my healthy weight (healthy, but in reality I wasn't healthy at all)
How was my body a healthy weight when I wasn't ingesting any meals? And at that point I was chsp on some food.I decided to turn things around and began eating meals along with lifting weights, initially I thought I was putting on weight, but I was reassured but a DR in Australia who specialised in ED and was looking into CHSP, that this was just water weight from what I was taking on. Eventually things levelled out and I dropped the pounds and gained more muscle and I was happy with myself! Even though I lost a couple of pounds I was still a healthy weight (I've never wanted to be incredibly skinny) the only problem was I still wasn't eating enough, I was consuming the amount of calories people would when dieting, or less. Eventually my muscle gains plateaued and slowly the weight crept back on. This was roughly 2 years ago and I'm not entirely sure why - maybe my body got use the the amount of calories, so I  should have continued increasing them.I now eat maybe a little bit more than then, but it is still a considerably low amount of calories yet I am not happy with my weight. I am not over weight and have a normal BMI. I just want to be able to eat a normal amount without gaining even more weight, but I'm scared to.I imagine my metabolism is to blame for this, or for some reason my body is holding onto the fat and not wanting to burn it? (Now I am heavier my recent test showed my RMR is Xkcal)I just can't understand how I am the size when I still don't eat enough. Has anyone else experienced this?Would appreciated any replies and stories if anyone would like to share.
Hope everyone is ok xx Amy",_admin_moderator,"Mon,03/15/2021-12:36pm","Dear barewithme, we would","Dear barewithme, we would like to inform you that we edited your post to remove detailed descriptions of disordered eating behaviors, as well as calorie numbers, which are not allowed on our forums and could be triggering to other users. You can review our community guidelines here. Thanks for your understanding and please continue to post! ",,,,
46,booster22,02/23/2021,Am I Still Worthy of Recovery?,"Hello, I am 16 years old, and I was diagnosed with anorexia nervosa in June of 2020.  I got my period back in December (yay),which is great news. However, I still eat so much now. I don't think I can distinguish between what is hunger and what is not.  I restricted yesterday, but I become frustrated because I can't restrict they way I use to.  Before, I'd eat X calories or less. Now, I eat X or more calories! That is way too much and I know it. I have an obsession with mirrors and the scale. Exercise is something that triggers me to feel awful about myself. I fear that when I see my doctor in over a week, she'll tell me I'm too fat and that I need to go on a diet..I'm new to this, so I'm sorry if this is all over the place. I'm just so worried and confused..",_admin_moderator,"Wed,02/24/2021-10:57am","Dear booster22, welcome to","Dear booster22, welcome to the NEDA Forums! We are writing to inform you that we edited your post to remove calorie numbers, and edited language about disordered eating behaviors, which could be triggering to other users. You can review our community guidelines here. Thanks for your understanding and please continue to post!  ",,,,
47,survivingtothriving,01/27/2021,Recovering when I was never medically underweight,"Hey y’all! I guess I just wanted to let off some stuff about this. I’ve recently started recovery and I’m really struggling with the fact that recovery doesn’t always have to mean weight restoration. I feel like every other anorexia/restrictive eating survivor had to go through this long, intense battle of gaining weight back, and although I do have serious medical issues from losing weight and I am at a low weight for my height, I’m not medically unstable enough to warrant having to regain a lot of weight. I think this is because I’m a fairly tall girl (5’7”) and also naturally have a pretty muscular frame, so I don’t lose weight all that easily and I’m just pretty sturdy naturally. It makes me feel really bad because I want recovery, but I feel like I don’t deserve to eat normal amounts as my frame is naturally bigger and I’m not visibly or medically considered underweight. I also feel like people see the whole “naturally bigger frame” thing as an excuse, and I just feel so invalidated in my struggles because I don’t fit the stereotypical image of my disorder. I know recovery looks different for everybody, and everyone’s set point weight is different, but it just hurts knowing that people think I look fine now when I’m not, and that I likely won’t fit the beauty standard when I get back to a healthy weight for me. Urgh. Anyone else with a more muscular/bigger build and AN relate to this? What helped you during recovery? Any words of wisdom or support? Big hugs and best wishes to all of you. <3",_admin_moderator,"Wed,02/10/2021-10:09am","Dear kyuxin, we would like to","Dear kyuxin, we would like to inform you that we edited your post to remove the name of the Youtouber and a description of physical appearance. You can review our community guidelines here. Thanks for your understanding and please continue to post! ",_admin_moderator,"Mon,02/22/2021-12:57am",Edited your comment,"Dear minigherkins, we would like to inform you that we edited your comment to remove weight and size numbers, which are not allowed on the forums. You can review our community guidelines here. Thanks for your understanding and please continue to post! "
48,amyie,02/15/2021,Weight gain during first week of treatment,"If you were inpatient and were on a meal plan, what was your experience with weight gain during the first week? And what about other weeks? Was it slower?
Thank you very much for answering!",_admin_moderator,"Mon,02/15/2021-8:44pm",Edited your post!,"Hi Amyrie - welcome to the forums! We’re glad you’re here. Your post had to be edited to comply with our Community Guidelines. Weight and calorie specifics can be triggering to other users. Please take a moment to review the guidelines, and please continue posting!",,,,
49,MacCroc,10/24/2020,Looking for recovery buddy,"Hello beautiful people! :)
I am looking for an online recovery buddy to support each other and keep each other accountable (like messaging every day and during crisis situations).
A bit about me: female in my late twenties, had an earting disorder for over 10 years, last 3 years in treatment and (more or less) recovery. Have been relapsing recently due to all the pandemic pressure and the fact that I think I was in ""pseudo-recovery"" before. This time I want to commit to full recovery without any ""safe thoughts"",  which probably means gaining weight and scares me.
Anyway, please message if you are also recovering and would like to be in touch to help each other!
PS I would prefer someone who is also still in recovery as opposed to already recovered and willing to help. Just a personal preference:)",_admin_moderator,"Sat,10/24/2020-10:02am",Hi MacCroc,"Hi MacCroc, we are glad to see you using the forums for the support. As a reminder, the NEDA forum guidelines do not allow the sharing of personal information, such as email/home addresses, phone numbers, real names, and social media details as a safety precaution. However, you’re more than welcome to continue to communicate with other members while on the forums. When you get a chance, please take a look at our community guidelines here: https://www.nationaleatingdisorders.org/forums/community-guidelines. If you need help locating resources, please contact the Helpline at (800) 931-2237. Phones are open Monday-Thursday 11AM-9PM EST and Friday 11 AM-5PM EST. Our online chat helpline is open Monday-Thursday 9AM-9PM EST and Friday 9AM-5PM EST. Please take care. ",,,,
50,kyuxin,02/10/2021,Preventing a relapse?,"Hey guys,During the last days I found it getting continuously harder staying on track with my recovery and I just feel like I'm on the verge of breaking down and relapsing?
Do you have any suggestions or experience as to what helped you if you ever felt like that?",_admin_moderator,"Wed,02/10/2021-6:30pm",Resources,"Dear Kyuxin, We’re sorry to hear that you’re feeling this way right now. We care about your safety and want to make sure you have all the support you need. As a reminder, you can also reach out to the NEDA helpline if you feel like you need more support or access to more resources in the meantime. The helpline phone hours are Monday through Thursday 11am-9pm ET and Friday 9am-5pm ET and can be reached by calling 800-932-2237; you can also use the online chat to speak to someone Monday through Thursday 9am-9pm ET and Friday 9am-5pm ET. The National Suicide Prevention Lifeline and Crisis Text Line are also available resources; if you’re ever feeling suicidal or overcome with stress, please don’t hesitate to contact the suicide lifeline at 800-273-TALK (8255) and the Crisis Text Line by texting “NEDA” to 741741. Please stay safe and take care.",,,,
51,Tosayimtrying,02/06/2021,"Lost of appetite w no triggers, 5 months into full recovery?","Hi everyone,Some bg info:
I've had no triggers or behaviors for about 5 months now. I do not have a theripast as we completed in October progress wise. :) My psychiatrist had even commented on my progress saying I was doing well recently, I was happy.It was all going well until about a week ago, I've suddenly lost my appetite for anything. I'm not pregnant (100% like period 2 days ago %) and I've had no recent change in plans or expectations. Now I've always had a hard time being hungry but I usually can snack and make myself meals to keep myself in check. As of recently though, I lack the motivation to even find the appeal in some simple foods.
I had tried talking to my boyfriend (I live by myself currently and hes been a great support, since I've been diagnosed and gotten treatment, relapses etc. (Since 15, OSFED, only done therapy) and he said I should try to eat something at least and confirmed the fact that I should be hungry. But somehow I can't even stomach things. I tried to eat some baked goods I made and I had a little bit but I just didn't want anymore. I feel kind of frustrated because I know I should he hungry, my body is hungry, but part of me is starting to go ""well you're not physically or mentally hungry.. so why eat?"" Which is the mindset that my eating disorder stems from but it feels logical! I'm not even weighing myself. I don't feel fat either. I feel happy too, or good/neutral/optimistic.I just don't want to eat.:/",_admin_moderator,"Sun,02/07/2021-11:50pm",Tosayimtrying,"Hi Tosayimtrying, welcome to the forums. We slightly edited your post to remove mentions of specific foods, which are not allowed on the forums in case they’re triggering to others – you can review our community guidelines here. 
We recommend that you speak with a medical doctor about your concerns with loss of appetite. The NEDA Helpline is also available for help with finding support or resources. The helpline phone hours are Monday through Thursday 11am-9pm ET and Friday 9am-5pm ET and can be reached by calling 800-932-2237; you can also use the online chat to speak to someone Monday through Thursday 9am-9pm ET and Friday 9am-5pm ET. Please don’t hesitate to reach out and keep posting.",,,,
