115,kaimore99,07/15/2020,Relapsing? ,"Hey all,I’m new here and I’ve really wanted to find some support for going on-and-off through my eating disorder recovery. When I was 17, I was diagnosed with bulimia, but my emotional and eating symptoms were more like anorexia, but my doctor didn’t diagnose me with it because I wasn’t below the normal weight for my age and height. Throughout the past 3 years, I’ve had relapses and recoveries, I am now 20 and I think I might be relapsing again, but I don’t know. I’ve started intermittent fasting and I think that’s starting to trigger the restrictive behaviours, but I don’t want to stop because I just want to look the way I used to when I was going through the most severe part of my eating disorder. I’ve never been hospitalized or had a real treatment recovery plan, I kinda just took it on myself throughout the years, with it getting better and then relapsing again. I just started feeling like this yesterday and it’s scary and I don’t wanna tell anybody. I live with my partner currently and I don’t want to tell him because I feel like I want to hide it which I know isn’t right, but I don’t want anybody being concerned for me or trying to get me to eat or stop fasting. I just don’t know if that sounds like a relapse or not, but I just wanted some support.",_admin_moderator,"Thu,07/16/2020-2:16pm",Dear kaimore99,Welcome to the forums! We hope that you find the support here that you are looking for and wanted to remind you that you can always reach out to our confidential NEDA Helpline. Our trained volunteers and staff are here to help you find additional support and resources. They are available by phone M-Th 11am-9pm ET and F 11am-5pm ET at 800.931.2237 and through online chat M-Th 9am-9pm ET and F 9am-5pm ET. Please don’t hesitate to reach out. Stay well and take care!,,,,
116,Crow546,07/12/2020,How to cope witha dieter in the family ,"So I've been in recovery for about 1 1/2-2 months now,I've been very active in recovery, even though I hit my occasional hurdles and walls, Im still determined to overcome this. Yet my sister is really huge into dieting and it's such a trigger for me, I cannot eat or even be in the same room with her when food is involved or I am immediately tempted to fall back in old habits. She is not aware of my ED, only my parents know, and when I see her engage in dieting behaviors I just feel like a failure for not 'competing' with her and not engaging in them, and since Im not engaging in them I am 'unhealthy'. Any advice for coping with diet talk and habits that you cannot avoid? I'd also like to mention while I'm at it, that I know recovery has alot of 'symptoms' when you start, I've semi-hurdled the bloating and constipation stage yet does anyone else still have discomfort in their chest? When I was at my worst I would constantly get chest pains and such, yet since I've been eating normally they have subsided, yet if I dont eat for a longer period of time I start to get out of breath and chest discomforts/throbs, is there a reason as to why this is happening? Even when I havent been starving myslef? Any feed back is much appreciated and welcomed! Thank you :)",_admin_moderator,"Sun,07/12/2020-11:52pm",Crow546,"Hi Crow546, welcome to the forums. We hope they are of help to you. We want to encourage you to speak with your medical provider about the physical symptoms you’re experiencing. Also, please feel free to reach out to the NEDA Helpline if you need more help finding support and resources. The helpline phone line can be reached at 1-800-931-2237 (Monday-Thursday 11:00am-9:00pm, Friday 11:00am-5:00pm EST). Helpline chat hours are Monday-Thursday from 9AM to 9PM ET and Friday 9AM to 5PM ET. Please continue to post, and take care!",,,,
117,herzna,07/10/2020,exhaustion and brain fog advice,"After weeks of thinking (listening to your amazing podcasts and studying the lasted research articles) about recovery, I decided to take action three days ago. I am committing to active recovery NOW! Ironically, I am a med student in my final year, being so underweight that if a doctor would see the number on the scale would have to force me into inpatient treatment- but the reality is, I am on the ward for 40 hours per week, surrounded by doctors and no one ever mentions my unacceptable appearance. Now I am struggling after increasing food and reducing my walking I feel incredibly exhausted all day and feel extreme brain fog. I have 10 weeks left on the ward (of 6 years med school) and I am wondering whether it would be better to wait with recovery after these 10 weeks or even after the final exam. On the other hand, I know that I struggled for 10 years now and have always been thinking that I can start enjoying life and eating afterwards. However, I feel so exhausted and have such a hard time every morning to get up in the morning since I started recovery that I am unsure whether I can manage both: recovery and finishing med school. What are your tips for exhaustion and brain fog- how long did it take you to get over that stage? Thank you very much in advance!",_admin_moderator,"Fri,07/10/2020-2:53pm",Dear herzna,"We are sorry to hear you are struggling, especially with the added medical school stress. That being said, we would like to encourage you to reach out to our confidential NEDA Helpline at 800.931.2237. You can speak with a trained volunteer who can help you find some additional resources and support in your area. Our helpline volunteers are available M-Th 11am-9pm ET and F 11am-5pm ET. Additionally you can chat with us online M-Th 9am-9pm ET and F 9am-5pm ET.   Also, because you mentioned some concerning symptoms we wanted to provide you with the following: The following are just some of the signs of a serious problem that demands immediate medical attention:
If you experience anything above, we highly recommend seeking help from a medical professional as soon as possible. Seek medical help soon on an outpatient basis if you:
 Please do not hesitate to reach out! It is important to stay well. We hope you continue to post on the forums. Take care!",,,,
118,Blue44,07/08/2020,Bad therapy session ,I had a session with a new therapist today. I had to get a new therapist because my other therapist is now out of network. It had been several months since I had therapy. I have only been seeing my psychiatrist. The new therapist cut my session short by ten minutes. It was very hurtful because I was talking about my thoughts of dying. This new therapist also doesn’t know anything about eating disorders. I feel deflated. I feel like quitting,_admin_moderator,"Thu,07/09/2020-9:32pm",Resources,"Hi, Blue44. We're sorry that you're going through a tough time. We're concerned about your safety based on the thoughts you described. We are providing you with a list of resources to reach out to for support:Please take care and stay safe. ",,,,
119,vicki_dallas,07/01/2020,Providers in Philly area?,Hi!  I'm looking for a PCP in the Philadelphia area who is eating disorder informed.  My last PCP was not helpful and mostly triggering.  Any recommendations?,_admin_moderator,"Wed,07/01/2020-1:53pm",Treatment Search Option,"Hi Vicky_dallas, welcome to the forums! We’re sorry that your last PCP was not helpful, and we have a resource that you might find helpful. Our NEDA Helpline can speak to you about doing a personalized treatment search for ED specialized medical doctors in your area! You can contact us via phone at number 800-931-2237 or chat through this website to discuss support options. Helpline phone hours are Monday-Thursday 11am-9pm ET, Friday 11am-5pm ET. Helpline chat hours are Monday-Thursday 9am-9pm ET, Friday 9am-5pm ET. ",,,,
120,hermione3,06/24/2020,struggling still...,Saw my doctor yesterday and I lost more weight which is not good and I was still dehydrated. I struggled to eat yesterday anyway and today I ate what I was craving but used behaviors. I have bloodwork Friday but everyone keeps saying the way I am doing I am going to end up in the hospital and do I really want that...do I though I can't seem to stop acting on behaviors and I am not being fully honest with my team...I wish I could just snap out of this but I can't seem to but I go to treatment come back and nothing changes...I am tired of fighting I can't afford to lose more weight and I hope my bloodwork on Friday is ok. we will see.,_admin_moderator,"Mon,06/29/2020-12:00am",hermione3,"Dear hermione3 – we are so sorry to hear you’ve been struggling. We want to encourage you to be in touch with your healthcare providers about your medical symptoms, and please call 1-800-273-8255 or text ""NEDA"" to 741-741 if you are in crisis. Stay strong and please take care. You are not alone.",,,,
121,Blue44,06/28/2020,Depressed,I’m feeling very depressed. My life is miserable. I don’t want to eat. I don’t enjoy anything about living.,_admin_moderator,"Sun,06/28/2020-11:21pm",Blue44,"Dear Blue44 – we’re sorry to hear you’re feeling like this. You mentioned some concerning feelings, and we wanted to post resources to reach out to if you need support: Stay strong, you are not alone. Please don’t hesitate to reach out.",,,,
122,Tinkamakka,06/27/2020,Bloating diarrhea while recovery,"Dear All, (Sorry if my English is not perfect I am writing from Hungary:)I would like to ask, whether it's normal, that at the beginning of recovery (means increasing food amount) I hadn't have  any problems with bloating, but after approx. 1-2 months it started, and was accompanied with diarrhea...and both are still my ""mates""..,Tried eat milk-free but that didn't help. I understand gastroparesis, but I am worried because of the delay, and that it could be some kind of other problem.  And normally how long does it take for it to decrease/go away? Should I give a rest to my digestive organs, or should I keep attacking them with the increased amount?
Thank you for the advice in advance! Kata",_admin_moderator,"Sat,06/27/2020-3:21pm",Welcome,"Hi Kata, welcome to the forums! We are glad you’re here. That is a great question, and we are glad that you are making progress on your recovery. However, we recommend that you speak to your doctor about this as they might have some more specific answers for you around what you’re struggling with, and as we are not medical professionals. If you would like to discuss further support opitons and resources you can contact number 800-931-2237 or access our chat options via this website. Helpline phone hours are Monday-Thursday 11am-9pm ET, Friday 11am-5pm ET. Helpline chat hours are Monday-Thursday 9am-9pm ET, Friday 9am-5pm ET. We hope you continue posting and again, welcome!",,,,
123,spiral462,06/23/2020,Shadow Just Behind,"I've been in recovery for 7/8ish years.
I have a two year old, and gained lots of weight during the pregnancy. I tried the ""embracing the new body"" mindset, eating healthier, etc. But I can feel the disorder creeping up again. I don't eat as often as I should.
I don't know how to lose weight any other way than starving myself.
Funnily enough, that seems easier and more instantly gratifying to me than just simply changing my diet.
About two weeks ago I started taking X supplement.
Being in recovery during these unprecedented times has been so challenging for me. I feel guilty for the weight I've gained, and I also feel guilty for worrying about my weight when there are so many bigger issues currently going on in the world.
My annorexia is calling to me, and it's so hard to ignore something that seems so comfortable.",_admin_moderator,"Tue,06/23/2020-3:47pm",Dear spiral462,"Dear spiral462,We have had to modify your post slightly due to potentially triggering content for other members including ED behaviors and supplements. Additionally, you have mentioned some concerning symptoms and we would like to encourage you to seek medical attention. You can always call our NEDA Helpline at 800.931.2237 M-Th 11am-9pm ET and F 11am-5pm ET or chat with us online M-Th 9am-9pm ET and F 9am-5pm ET. If you feel you are in crisis please do not hesitate to text “NEDA” to 741-741. Take care and stay well!",,,,
124,Blue44,06/22/2020,Deep dark hole ,I’m really struggling a lot. I feel like whenever I eat anything it’s too much. I really hate myself. I feel fat. I feel worthless. I should be sleeping right now but I’m not feeling well physically. I’m having anxiety medicine withdrawals because I’m out of medicine because I have been taking too much. I don’t see my psychiatrist until Wednesday. Life is miserable for me right now. I am feeling like I’m at the bottom of a deep hole and I can’t get out.,_admin_moderator,"Mon,06/22/2020-8:35pm",Resources,"Hi Blue44 (and Hermione3) - we're so sorry you're having a hard time today. Please remember these resources are available if you need to reach out for support: 
Take good care of yourselves.",,,,
125,hermione3,06/20/2020,Feeling I’m not sure...,My bloodwork came back normal this week so I feel I am fine now and can just act on behaviors and be fine that’s not a good thing. And I am also sort of let down they are normal like I wanted it to be bad to feel sick enough... now I feel better and can just do what I want.,_admin_moderator,"Sun,06/21/2020-11:57pm",hermione3,"Hi hermione 3 – you mentioned some concerning feelings and physical symptoms and we encourage you to seek help as soon as possible. Please don’t hesitate to contact your medical providers. Additionally, please reach out to any of the following resources if you are in crisis:You are not alone. Please reach out for help and support, and take care.",,,,
126,weouthere,06/21/2020,Feeling helpless,"Does anyone else just feel so broken sometimes? Like your ED has had a vice on you for so long, destroying relationships and any chance of having a normal life? To the point where you’re not sure if recovery is even possible at this point? Yeah, me too.",_admin_moderator,"Sun,06/21/2020-11:33pm",Resources,"Dear weoouthere – you mentioned some concerning feelings, and we want to make sure you know there are resources available if you need support: Additionally, the  NEDA Helpline phone line can be reached at 1-800-931-2237 (Monday-Thursday 11:00am-9:00pm, Friday 11:00am-5:00pm EST). Helpline chat hours are Monday-Thursday from 9AM to 9PM ET and Friday 9AM to 5PM ET.   You are not alone. Please don’t hesitate to seek help, and take care.",,,,
127,Miggi,06/20/2020,I hate myself,"I just ate some junk food from a fast food establishment, and it was totally unplanned. It was very tasty, but I feel so bad. I feel so fat, and like I don't deserve it. But I know I won't restrict to make up for it... I'm just going to keep eating... God I hate myself. I feel so guilty.",_admin_moderator,"Sun,06/21/2020-11:30pm",Miggi ,"Dear Miggi – we are sorry you’re experiencing these difficult. Please call 1-800-273-8255 or text ""NEDA"" to 741-741 if you are in crisis. We encourage you to reach out if you need and please take care. Stay strong, you are not alone.",,,,
128,2Healthy4me,06/15/2020,I Haven't Had a Period in 4 months and It Feels Sooo Good too!!,"My gyny Dr wants me to come in for a sonogram but my coverage has changed.
No more female hormone daily, that was driving me nuts! I stopped taking all my asthma meds, as well as my sleep med. Now I am down to my pills for Seasonal Affective Disorder, and Binge Eating.I also take other medications for depression and pain.
So I'm down to 5 pills a day, 2 in the morning, and 3 at night. Ever since the early vacation wee teacher's have had to take, involuntarily, and with not too much to do all day, I have lost my appetite following breakfast.
I weight myself often. I am feeling a tad on the restrictive-OCD side of eating, restricting and exercising, and feeling depressed when every the scale numbers go up in spite of my efforts to get a grip and have a eating routine and an exercise routine and take prescriptions to help me where my will power cannot.
What should i do next? I feel so out of shape and don' wish to eat as it would seem like im eating out of Boredom, and that i cant allow myself to fall prey to.",_admin_moderator,"Tue,06/16/2020-3:53pm",Dear iFast2eat,"We have had to edit your post of triggering content and medical specifics that are not permitted on the forum. We hope you understand. Additionally, we are concerned with some of the things you have said and would like to encourage you to reach out for support. You can call our NEDA Helpline at 800.931.2237 M-Th 11am-9pm ET and F 11am-5pm ET or chat with us online M-Th 9am-9pm ET and F 9am-5pm ET. Stay well and take care!",,,,
129,Tryingtoheal,06/12/2020,Blue44,Any news on treatment?,_admin_moderator,"Mon,06/15/2020-2:30am",Blue44,"Dear Blue44, we are sorry you’re experiencing these difficult feelings and we are concerned about your well-being. Please call 1-800-273-8255 or text ""NEDA"" to 741-741 if you are in crisis. Please take care – you are not alone.",,,,
130,London1621,06/11/2020,Keep things to myself ,Want to keep how I'm feeling to myself. Don't want to tell my parents or sister. This is why I hate myself sometimes.,_admin_moderator,"Mon,06/15/2020-2:22am",London1621,"Dear London1621, we are sorry you’re feeling alone and we are concerned about your well-being. Please call 1-800-273-8255 or text ""NEDA"" to 741-741 if you are in crisis. We encourage you to reach out and please take care – you are not alone.",,,,
131,bunnyteaparty,06/10/2020,Doubts,"I've technically been recovering for about a year now, and I've started looking back at before going into recovery and seeking recovery. I keep feeling guilty and wrong for the fact that I sought out treatment myself rather than someone making me, and that it was for myself, when everyone at my old treatment center seemed to have been forced or going in for non-selfish reasons. I sought recovery because I discovered more about what eating dsorders were and got tired of suffering. It makes me feel like I wasn't sick enough, despite the fact that I was diagnosed with anorexia and food and weight really did take over my life for years. It makes me feel like I was just going through disordered eating and was being overdramatic. I felt so motivated in the beginning of my recovery, and while yes much of that motivation did go down after realizing how difficult recovery was overtime, it just makes me feel so guilty that right at the beginning, I did try to eat the meals they put in front of me without much pushback, while I felt scared, I also felt glad to eat. I know that's technically a good thing, but it just doesn't feel like the ""right"" thing a person with an eating disorder would do. Now I'm just in this weird ""partial recovery"" stage where I'm eating somewhat regularly, but I'm still scare to eat certain foods and still keep certain impulses. I just want to relapse, I feel so guilty anytime I give in to my hunger and eat, but with my hunger cues being back for so long at this point it can be difficult not to. Right now I feel so hungry, but I'm scared to eat because I know if I did eat I'd be failing. I just wish I could go back in time and tell myself to never go into recovery, to keep going to see how long somebody notices, or until it's too late to recover. Funny how when I was in the treatment center, I remember saying that I was scared of relasping in the future, now I'm scare of never relasping. Does anyone else have any similar doubts and feelings? I just don't know what to do, a part of me still wants recovery, but it feels so wrong.",_admin_moderator,"Wed,06/10/2020-7:29pm","Dear bunnyteaparty, You have","Dear bunnyteaparty, You have brought up some concerning feelings and we wanted to post some available resources to you if you need support.·      If you feel you are in crisis please text “NEDA” to 741-741.··      National Suicide Prevention Lifeline: 800.237.8255··      NEDA Confidential Helpline: 800.931.2237 (M-TH 11am-9pm ET, F 11am-5pm ET)·  ·  NEDA Online Chat: https://chatserver.comm100.com/ChatWindow.aspx?siteId=144464&planId=467Please don’t hesitate to reach out and seek help. Stay strong and take care!",,,,
132,Blue44,06/10/2020,Psychiatrist appointment today ,"I’m so frustrated by my psychiatrist appointment today. She told me that I needed to decide to be happy. I wish it were that easy. I have major depression and bad thoughts (I won’t be specific on my thoughts). She doesn’t take me serious about my thoughts.
Thanks for listening to me vent",_admin_moderator,"Thu,06/11/2020-2:46pm",Dear Blue44,We at NEDA are concerned and want to encourage you to reach out for support should you need it. If you are in crisis please do not hesitate to text “NEDA” to  741-741. You can also call our confidential NEDA Helpline at 800.931.2237 for additional resources M-Th 11am-9pm ET and F 11am-5pm ET or chat with us online M-Th 9am-9pm ET and F 9am-5pm ET.  Stay well and take care!,,,,
133,Tryingtoheal,06/06/2020,Blue44,you seriously need to get help for being suicidal.   Do what you need to stay safe.,_admin_moderator,"Sat,06/06/2020-3:06pm",Resources to Help,"Hi Blue44! We commented this on a previous post of yours, but in case you didn’t see it, we have some resources that we really recommend that you reach out to at this time. Again, we are sorry that you are feeling this way, and want you to be safe. Please reach out to the Crisis Text Line by texting “NEDA” to 741-741, call the National Suicide Prevention Lifeline at 1-800-273-TALK (8255), or go to: http://www.suicidepreventionlifeline.org. Hopefully these will help you find the support you deserve. We wish you the best.",,,,
134,iwanttolive,06/05/2020,Blue44,Hi.  I saw that you said that you weren't doing very well.  How are you tonight and can you say what is going on?  I think you said your husband doesn't like his job and you can't work if I remember correctly.  Does he act angry after he works?  How can we best support you?Thank you for your kindness to me and your support.  Take care.,_admin_moderator,"Sat,06/06/2020-2:41pm",Support,"Hi Blue44, we are sorry to hear that you’ve been struggling lately! We’re glad that you reached out to the forums, but are concerned for your safety and I want you to be safe. Please text ""NEDA"" to 741741 to be connected with a trained volunteer at Crisis Text Line or call the National Suicide Prevention Lifeline at 1-800-273-TALK (8255). We wish you the best!",,,,
135,Kilee15,06/05/2020,I've started falling into old habits,I didn’t eat too much today. Plus a treat. I really didn't want to eat the food but I was afraid my dad would get angry with me if I didn't eat it. The treat was pretty good tho.,_admin_moderator,"Fri,06/05/2020-2:35pm",Dear Kilee15,We have had to edit you post of specific foods that were listed as it is not permitted on the forums. You can review our community guidelines here : https://www.nationaleatingdisorders.org/forums/community-guidelines  Take care!,,,,
136,Blue44,06/04/2020,Very upset. ,I’m not doing well. I’m very upset with my life right now. I hate living. I don’t want to eat.,_admin_moderator,"Thu,06/04/2020-2:33pm",Dear Blue44,You have brought up some concerning feelings and we want to encourage you to reach out for support. If you are in crisis please do not hesitate to text “NEDA” to 741-741. You can also call our confidential NEDA Helpline at 800.931.2237 M-Th 11am-9pm ET and F 11am-5pm ET or chat with us online 9am-9pm M-Th ET and F 9am-5pm. Take care!,,,,
137,hermione3,05/29/2020,Feeling like a failure ,I am not even on my full usual meal plan as I am not ready I am supposed to add something though but it has been hard and I feel guilty when I do well. I am anxious about work next week I am working with all different kids I list my whole class. My kids moved up to preschool others moved out of state I am just sad it won’t be the same. I am not working with my coteacher and I feel lost and sad and I can’t handle it they have tough kids in that class I am tired I just can’t handle much right now. Trauma stuff is hitting me and starting with a new therapist has been hard sometimes I miss my old one even if I feel I made the right decision. I saw her for 12 years it’s just hard. My parents do nice things but when I talk they don’t listen...like they offer zero emotional support and I struggle seeing people who are close with their siblings I feel such a loss because my brother abused me horribly but it’s a loss... I feel so alone and sad and broken also like my friend just published a kids book most of my friends have better jobs don’t need as much financial support from my parents. Still not over my eating disorder and trauma...I am just a failure,_admin_moderator,"Sun,05/31/2020-11:15pm",hermione3,"Dear hermione3 – we are sorry you’re experiencing these difficult feelings and we are concerned about your well-being. Please call 1-800-273-8255 or text ""NEDA"" to 741-741 if you are in crisis. We encourage you to reach out and please take care – you are not alone.",,,,
